{
  "$schema": "https://json-schema.org/draft/2020-12/schema",
  "title": "config/municipalities.json",
  "description": "Číselník obcí obou krajů z veřejných dat ČSÚ. Soubor generuje tools/pipeline/municipalities.py a needituje se ručně — ručně dopsaná obec je nedoložená.",
  "type": "object",
  "required": ["schema_version", "source", "municipalities"],
  "additionalProperties": false,
  "properties": {
    "schema_version": {"const": 1},
    "updated_at": {"$ref": "#/$defs/timestamp"},
    "generator": {"type": "string", "minLength": 1},
    "source": {
      "type": "object",
      "description": "Doklad o původu číselníku. Bez adresy a data stažení není seznam ověřitelný.",
      "required": ["name", "publisher", "url", "downloaded_at", "valid_from"],
      "additionalProperties": false,
      "properties": {
        "name": {"type": "string", "minLength": 1},
        "publisher": {"type": "string", "minLength": 1},
        "codelist": {"type": "string", "minLength": 1},
        "landing_page": {"type": "string", "pattern": "^https?://"},
        "url": {"type": "string", "pattern": "^https?://"},
        "downloaded_at": {"$ref": "#/$defs/date"},
        "valid_from": {"$ref": "#/$defs/date"}
      }
    },
    "counts": {
      "type": "object",
      "description": "Odvozený souhrn. Přepočítává ho generátor, ne člověk.",
      "required": ["total"],
      "additionalProperties": {"type": "integer", "minimum": 0},
      "properties": {
        "total": {"type": "integer", "minimum": 1}
      }
    },
    "municipalities": {
      "type": "array",
      "minItems": 1,
      "items": {
        "type": "object",
        "required": ["code", "name", "type", "district", "region"],
        "additionalProperties": false,
        "properties": {
          "code": {
            "type": "integer",
            "minimum": 100000,
            "maximum": 999999,
            "description": "Kód obce z číselníku ČSÚ 43 (CISOB), shodný s kódem obce v RÚIAN."
          },
          "name": {"type": "string", "minLength": 1},
          "type": {
            "enum": ["obec", "mestys", "mesto", "statutarni-mesto", "hlavni-mesto", "vojensky-ujezd"],
            "description": "Typ sídla podle sloupce obec_typ ve zdroji."
          },
          "district": {
            "type": "string",
            "minLength": 1,
            "description": "Název okresu, shodný s name v config/districts.json."
          },
          "region": {"enum": ["pardubicky-kraj", "kralovehradecky-kraj"]}
        }
      }
    }
  },
  "$defs": {
    "date": {
      "type": "string",
      "pattern": "^\\d{4}-\\d{2}-\\d{2}$"
    },
    "timestamp": {
      "type": "string",
      "pattern": "^\\d{4}-\\d{2}-\\d{2}T\\d{2}:\\d{2}:\\d{2}(\\.\\d+)?([+-]\\d{2}:\\d{2}|Z)$"
    }
  }
}
