{
  "schema_version": 1,
  "updated_at": "2026-08-02T23:23:03+02:00",
  "generator": "tools/pipeline/municipalities.py",
  "source": {
    "name": "Struktura území ČR – otevřená data",
    "publisher": "Český statistický úřad",
    "codelist": "ČSÚ číselník 43 (CISOB); kód obce je shodný s kódem obce v RÚIAN",
    "landing_page": "https://csu.gov.cz/i_zakladni_uzemni_ciselniky_na_uzemi_cr_a_klasifikace_cz_nuts",
    "url": "https://csu.gov.cz/docs/107516/f1a13e13-9af2-462b-4b9e-2f0aee9997c6/struktura_uzemi_cr.csv?version=1.2",
    "downloaded_at": "2026-08-02",
    "valid_from": "2026-01-01"
  },
  "counts": {
    "total": 899,
    "kralovehradecky-kraj": 448,
    "pardubicky-kraj": 451
  },
  "municipalities": [
    {"code":569828,"name":"Babice","type":"obec","district":"Hradec Králové","region":"kralovehradecky-kraj"},
    {"code":569836,"name":"Barchov","type":"obec","district":"Hradec Králové","region":"kralovehradecky-kraj"},
    {"code":569852,"name":"Běleč nad Orlicí","type":"obec","district":"Hradec Králové","region":"kralovehradecky-kraj"},
    {"code":569861,"name":"Benátky","type":"obec","district":"Hradec Králové","region":"kralovehradecky-kraj"},
    {"code":569879,"name":"Blešno","type":"obec","district":"Hradec Králové","region":"kralovehradecky-kraj"},
    {"code":569887,"name":"Boharyně","type":"obec","district":"Hradec Králové","region":"kralovehradecky-kraj"},
    {"code":569917,"name":"Černilov","type":"obec","district":"Hradec Králové","region":"kralovehradecky-kraj"},
    {"code":569925,"name":"Černožice","type":"obec","district":"Hradec Králové","region":"kralovehradecky-kraj"},
    {"code":570109,"name":"Chlumec nad Cidlinou","type":"mesto","district":"Hradec Králové","region":"kralovehradecky-kraj"},
    {"code":570125,"name":"Chudeřice","type":"obec","district":"Hradec Králové","region":"kralovehradecky-kraj"},
    {"code":569933,"name":"Čistěves","type":"obec","district":"Hradec Králové","region":"kralovehradecky-kraj"},
    {"code":569941,"name":"Divec","type":"obec","district":"Hradec Králové","region":"kralovehradecky-kraj"},
    {"code":569968,"name":"Dobřenice","type":"obec","district":"Hradec Králové","region":"kralovehradecky-kraj"},
    {"code":569976,"name":"Dohalice","type":"obec","district":"Hradec Králové","region":"kralovehradecky-kraj"},
    {"code":569984,"name":"Dolní Přím","type":"obec","district":"Hradec Králové","region":"kralovehradecky-kraj"},
    {"code":569992,"name":"Habřina","type":"obec","district":"Hradec Králové","region":"kralovehradecky-kraj"},
    {"code":570001,"name":"Hlušice","type":"obec","district":"Hradec Králové","region":"kralovehradecky-kraj"},
    {"code":570010,"name":"Hněvčeves","type":"obec","district":"Hradec Králové","region":"kralovehradecky-kraj"},
    {"code":570028,"name":"Holohlavy","type":"obec","district":"Hradec Králové","region":"kralovehradecky-kraj"},
    {"code":570044,"name":"Hořiněves","type":"obec","district":"Hradec Králové","region":"kralovehradecky-kraj"},
    {"code":569810,"name":"Hradec Králové","type":"statutarni-mesto","district":"Hradec Králové","region":"kralovehradecky-kraj"},
    {"code":570052,"name":"Hrádek","type":"obec","district":"Hradec Králové","region":"kralovehradecky-kraj"},
    {"code":570087,"name":"Humburky","type":"obec","district":"Hradec Králové","region":"kralovehradecky-kraj"},
    {"code":573621,"name":"Hvozdnice","type":"obec","district":"Hradec Králové","region":"kralovehradecky-kraj"},
    {"code":570133,"name":"Jeníkovice","type":"obec","district":"Hradec Králové","region":"kralovehradecky-kraj"},
    {"code":576352,"name":"Jílovice","type":"obec","district":"Hradec Králové","region":"kralovehradecky-kraj"},
    {"code":570150,"name":"Káranice","type":"obec","district":"Hradec Králové","region":"kralovehradecky-kraj"},
    {"code":570168,"name":"Klamoš","type":"obec","district":"Hradec Králové","region":"kralovehradecky-kraj"},
    {"code":573710,"name":"Kobylice","type":"obec","district":"Hradec Králové","region":"kralovehradecky-kraj"},
    {"code":570176,"name":"Kosice","type":"obec","district":"Hradec Králové","region":"kralovehradecky-kraj"},
    {"code":570184,"name":"Kosičky","type":"obec","district":"Hradec Králové","region":"kralovehradecky-kraj"},
    {"code":570192,"name":"Králíky","type":"obec","district":"Hradec Králové","region":"kralovehradecky-kraj"},
    {"code":570206,"name":"Kratonohy","type":"obec","district":"Hradec Králové","region":"kralovehradecky-kraj"},
    {"code":570214,"name":"Kunčice","type":"obec","district":"Hradec Králové","region":"kralovehradecky-kraj"},
    {"code":576433,"name":"Ledce","type":"obec","district":"Hradec Králové","region":"kralovehradecky-kraj"},
    {"code":570222,"name":"Lejšovka","type":"obec","district":"Hradec Králové","region":"kralovehradecky-kraj"},
    {"code":570231,"name":"Lhota pod Libčany","type":"obec","district":"Hradec Králové","region":"kralovehradecky-kraj"},
    {"code":570249,"name":"Libčany","type":"obec","district":"Hradec Králové","region":"kralovehradecky-kraj"},
    {"code":570257,"name":"Libníkovice","type":"obec","district":"Hradec Králové","region":"kralovehradecky-kraj"},
    {"code":570265,"name":"Librantice","type":"obec","district":"Hradec Králové","region":"kralovehradecky-kraj"},
    {"code":570273,"name":"Libřice","type":"obec","district":"Hradec Králové","region":"kralovehradecky-kraj"},
    {"code":570290,"name":"Lišice","type":"obec","district":"Hradec Králové","region":"kralovehradecky-kraj"},
    {"code":570311,"name":"Lochenice","type":"obec","district":"Hradec Králové","region":"kralovehradecky-kraj"},
    {"code":570303,"name":"Lodín","type":"obec","district":"Hradec Králové","region":"kralovehradecky-kraj"},
    {"code":570320,"name":"Lovčice","type":"obec","district":"Hradec Králové","region":"kralovehradecky-kraj"},
    {"code":570354,"name":"Lužany","type":"obec","district":"Hradec Králové","region":"kralovehradecky-kraj"},
    {"code":570362,"name":"Lužec nad Cidlinou","type":"obec","district":"Hradec Králové","region":"kralovehradecky-kraj"},
    {"code":573779,"name":"Máslojedy","type":"obec","district":"Hradec Králové","region":"kralovehradecky-kraj"},
    {"code":570397,"name":"Měník","type":"obec","district":"Hradec Králové","region":"kralovehradecky-kraj"},
    {"code":570401,"name":"Mlékosrby","type":"obec","district":"Hradec Králové","region":"kralovehradecky-kraj"},
    {"code":570419,"name":"Mokrovousy","type":"obec","district":"Hradec Králové","region":"kralovehradecky-kraj"},
    {"code":570427,"name":"Myštěves","type":"obec","district":"Hradec Králové","region":"kralovehradecky-kraj"},
    {"code":570435,"name":"Mžany","type":"obec","district":"Hradec Králové","region":"kralovehradecky-kraj"},
    {"code":570451,"name":"Nechanice","type":"mesto","district":"Hradec Králové","region":"kralovehradecky-kraj"},
    {"code":570443,"name":"Neděliště","type":"obec","district":"Hradec Králové","region":"kralovehradecky-kraj"},
    {"code":570478,"name":"Nepolisy","type":"obec","district":"Hradec Králové","region":"kralovehradecky-kraj"},
    {"code":570494,"name":"Nové Město","type":"obec","district":"Hradec Králové","region":"kralovehradecky-kraj"},
    {"code":570508,"name":"Nový Bydžov","type":"mesto","district":"Hradec Králové","region":"kralovehradecky-kraj"},
    {"code":548065,"name":"Obědovice","type":"obec","district":"Hradec Králové","region":"kralovehradecky-kraj"},
    {"code":570516,"name":"Ohnišťany","type":"obec","district":"Hradec Králové","region":"kralovehradecky-kraj"},
    {"code":570524,"name":"Olešnice","type":"obec","district":"Hradec Králové","region":"kralovehradecky-kraj"},
    {"code":570532,"name":"Osice","type":"obec","district":"Hradec Králové","region":"kralovehradecky-kraj"},
    {"code":570541,"name":"Osičky","type":"obec","district":"Hradec Králové","region":"kralovehradecky-kraj"},
    {"code":570567,"name":"Petrovice","type":"obec","district":"Hradec Králové","region":"kralovehradecky-kraj"},
    {"code":570575,"name":"Písek","type":"obec","district":"Hradec Králové","region":"kralovehradecky-kraj"},
    {"code":570648,"name":"Prasek","type":"obec","district":"Hradec Králové","region":"kralovehradecky-kraj"},
    {"code":570656,"name":"Praskačka","type":"obec","district":"Hradec Králové","region":"kralovehradecky-kraj"},
    {"code":570672,"name":"Předměřice nad Labem","type":"obec","district":"Hradec Králové","region":"kralovehradecky-kraj"},
    {"code":570681,"name":"Převýšov","type":"obec","district":"Hradec Králové","region":"kralovehradecky-kraj"},
    {"code":530671,"name":"Pšánky","type":"obec","district":"Hradec Králové","region":"kralovehradecky-kraj"},
    {"code":573531,"name":"Puchlovice","type":"obec","district":"Hradec Králové","region":"kralovehradecky-kraj"},
    {"code":570702,"name":"Račice nad Trotinou","type":"obec","district":"Hradec Králové","region":"kralovehradecky-kraj"},
    {"code":570711,"name":"Radíkovice","type":"obec","district":"Hradec Králové","region":"kralovehradecky-kraj"},
    {"code":570729,"name":"Radostov","type":"obec","district":"Hradec Králové","region":"kralovehradecky-kraj"},
    {"code":570745,"name":"Roudnice","type":"obec","district":"Hradec Králové","region":"kralovehradecky-kraj"},
    {"code":573191,"name":"Sadová","type":"obec","district":"Hradec Králové","region":"kralovehradecky-kraj"},
    {"code":571016,"name":"Šaplava","type":"obec","district":"Hradec Králové","region":"kralovehradecky-kraj"},
    {"code":570796,"name":"Sendražice","type":"obec","district":"Hradec Králové","region":"kralovehradecky-kraj"},
    {"code":570800,"name":"Skalice","type":"obec","district":"Hradec Králové","region":"kralovehradecky-kraj"},
    {"code":570834,"name":"Skřivany","type":"obec","district":"Hradec Králové","region":"kralovehradecky-kraj"},
    {"code":570851,"name":"Sloupno","type":"obec","district":"Hradec Králové","region":"kralovehradecky-kraj"},